<?xml version="1.0" encoding="UTF-8"?>
<quests xmlns:xsi="http://www.w3.org/2001/XMLSchema-instance"
	xsi:noNamespaceSchemaLocation="quest.xsd">

	<quest id="1000" start_npc_id="0" end_npc_id="0"/>
	<quest id="2000" start_npc_id="0" end_npc_id="0"/>

	<quest id="1101" start_npc_id="203049" end_npc_id="203057"/>

	<quest id="1102" start_npc_id="203057" end_npc_id="203057">

		<quest_event type="on_kill" ids="210133, 210134, 210705">
			<condition operate="AND">
				<quest_var op="LESSER" var_id="0" value="3" />
			</condition>
			<operations>
				<incrase_quest_var var_id="0" value="1" />
			</operations>
		</quest_event>

		<quest_event type="on_talk" ids="203057">
			<condition operate="AND">
				<dialog_id op="EQUAL" value="25" />
				<quest_status op="EQUAL" value="START" />
			</condition>
			<operations>
				<npc_dialog id="1352" />
			</operations>
		</quest_event>
	</quest>

	<quest id="1103" start_npc_id="203057" end_npc_id="203057"/>

	<quest id="1104" start_npc_id="203057" end_npc_id="203059"/>

	<quest id="1105" start_npc_id="203050" end_npc_id = "203050" />

	<quest id="1106" start_npc_id="203050" end_npc_id = "203061" />

	<quest id="1108" start_npc_id="203061" end_npc_id = "203061" />

	<quest id="1109" start_npc_id="798007" end_npc_id = "798007" />

	<quest id="1110" start_npc_id="203065" end_npc_id = "730008" />

	<quest id="1111" start_npc_id="203075" end_npc_id = "203075" />

	<quest id="1112" start_npc_id="203072" end_npc_id="203072">
		<quest_event type="on_kill" ids="210259, 210260, 210672">
			<condition operate="AND">
				<quest_var op="LESSER" var_id="0" value="5" />
			</condition>
			<operations>
				<incrase_quest_var var_id="0" value="1" />
			</operations>
		</quest_event>

		<quest_event type="on_kill" ids="210065, 210066">
			<condition operate="AND">
				<quest_var op="LESSER" var_id="1" value="5" />
			</condition>
			<operations>
				<incrase_quest_var var_id="1" value="1" />
			</operations>
		</quest_event>

		<quest_event type="on_talk" ids="203072">
			<condition operate="AND">
				<dialog_id op="EQUAL" value="25" />
				<quest_var op="GREATER_EQUAL" var_id="0" value="5" />
				<quest_var op="GREATER_EQUAL" var_id="1" value="5" />
				<quest_status op="EQUAL" value="START" />
			</condition>
			<operations>
				<npc_dialog id="1352" />
			</operations>
		</quest_event>
	</quest>
</quests>